,0
0,"Seven (feat. Latto) (Explicit Ver.) Latto, Jung Kook"
1,LALA Myke Towers
2,vampire Olivia Rodrigo
3,Cruel Summer Taylor Swift
4,WHERE SHE GOES Bad Bunny
5,"Sprinter Dave, Central Cee"
6,"Ella Baila Sola Eslabon Armado, Peso Pluma"
7,Columbia Quevedo
8,fukumean Gunna
9,"La Bebe - Remix Peso Pluma, Yng Lvcas"
10,"un x100to Bad Bunny, Grupo Frontera"
11,Super Shy NewJeans
12,Flowers Miley Cyrus
13,Daylight David Kushner
14,As It Was Harry Styles
15,Kill Bill SZA
16,Cupid - Twin Ver. Fifty Fifty
17,"What Was I Made For? [From The Motion Picture ""Barbie""] Billie Eilish"
18,"Classy 101 Feid, Young Miko"
19,Like Crazy Jimin
20,"LADY GAGA Gabito Ballesteros, Junior H, Peso Pluma"
21,I Can See You (Taylorï¿½ï¿½ï¿½s Version) (From The  Taylor Swift
22,I Wanna Be Yours Arctic Monkeys
23,"Peso Pluma: Bzrp Music Sessions, Vol. 55 Bizarrap, Peso Pluma"
24,"Popular (with Playboi Carti & Madonna) - The Idol Vol. 1 (Music from the HBO Original Series) The Weeknd, Madonna, Playboi Carti"
25,SABOR FRESA Fuerza Regida
26,"Calm Down (with Selena Gomez) Rï¿½ï¿½ma, Selena G"
27,"MOJABI GHOST Tainy, Bad Bunny"
28,Last Night Morgan Wallen
29,Dance The Night (From Barbie The Album) Dua Lipa
30,Rush Troye Sivan
31,"TULUM Peso Pluma, Grupo Frontera"
32,"Creepin' The Weeknd, 21 Savage, Metro Boomin"
33,Anti-Hero Taylor Swift
34,"TQG Karol G, Shakira"
35,"Los del Espacio Big One, Duki, Lit Killah, Maria Becerra, FMK, Rusherking, Emilia, Tiago pzk"
36,"Frï¿½ï¿½gil (feat. Grupo Front Yahritza Y Su Esencia, Grupo Frontera"
37,Blank Space Taylor Swift
38,Style Taylor Swift
39,TQM Fuerza Regida
40,"El Azul Junior H, Peso Pluma"
41,"Sunflower - Spider-Man: Into the Spider-Verse Post Malone, Swae Lee"
42,"I'm Good (Blue) Bebe Rexha, David Guetta"
43,"See You Again Tyler, The Creator, Kali Uchis"
44,"Barbie World (with Aqua) [From Barbie The Album] Nicki Minaj, Aqua, Ice Spice"
45,Angels Like You Miley Cyrus
46,I Ain't Worried OneRepublic
47,Die For You The Weeknd
48,"Starboy The Weeknd, Daft Punk"
49,"Die For You - Remix Ariana Grande, The Weeknd"
50,"El Cielo Feid, Myke Towers, Sky Rompiendo"
51,"Baby Don't Hurt Me David Guetta, Anne-Marie, Coi Leray"
52,AMARGURA Karol G
53,(It Goes Like) Nanana - Edit Peggy Gou
54,Another Love Tom Odell
55,Blinding Lights The Weeknd
56,Moonlight Kali Uchis
57,La Bachata Manuel Turizo
58,S91 Karol G
59,cardigan Taylor Swift
60,"Tï¿½ï¿ dennis, MC Kevin o Chris"
61,"Boy's a liar Pt. 2 PinkPantheress, Ice Spice"
62,"Left and Right (Feat. Jung Kook of BTS) Charlie Puth, BTS, Jung Kook"
63,"BESO Rauw Alejandro, ROSALï¿½"
64,"Hey Mor Ozuna, Feid"
65,Yellow Chris Molitor
66,Karma Taylor Swift
67,People Libianca
68,Overdrive Post Malone
69,Enchanted (Taylor's Version) Taylor Swift
70,"BABY HELLO Rauw Alejandro, Bizarrap"
71,Heat Waves Glass Animals
72,golden hour JVKE
73,Sweater Weather The Neighbourhood
74,"Quevedo: Bzrp Music Sessions, Vol. 52 Bizarrap, Quevedo"
75,Viva La Vida Coldplay
76,Here With Me d4vd
77,"Unholy (feat. Kim Petras) Sam Smith, Kim Petras"
78,"Yandel 150 Yandel, Feid"
79,CORAZï¿½ï¿½N VA Maria Becerra
80,Riptide Vance Joy
81,"Until I Found You (with Em Beihold) - Em Beihold Version Em Beihold, Stephen Sanchez"
82,"Novidade na ï¿½ï¿ Mc Livinho, DJ Matt D"
83,Back To December (Taylor's Version) Taylor Swift
84,"STAY (with Justin Bieber) Justin Bieber, The Kid Laroi"
85,"El Merengue Marshmello, Manuel Turizo"
86,Someone You Loved Lewis Capaldi
87,"Me Porto Bonito Chencho Corleone, Bad Bunny"
88,Makeba Jain
89,"MONTAGEM - FR PUNK Ayparia, unxbected"
90,Fast Car Luke Combs
91,What It Is (Solo Version) Doechii
92,"Coco Chanel Bad Bunny, Eladio Carrion"
93,Donï¿½ï¿½ï¿½t Bl Taylor Swift
94,Still With You Jung Kook
95,"All My Life (feat. J. Cole) J. Cole, Lil Durk"
96,Say Yes To Heaven Lana Del Rey
97,Snooze SZA
98,Summertime Sadness Lana Del Rey
99,Take Two BTS
100,Lover Taylor Swift
101,"Too Many Nights (feat. Don Toliver & with Future) Future, Metro Boomin, Don Toliver"
102,Chemical Post Malone
103,Mockingbird Eminem
104,New Jeans NewJeans
105,Primera Cita Carin Leon
106,"Cold Heart - PNAU Remix Dua Lipa, Elton John, Pnau"
107,Dandelions Ruth B.
108,Bones Imagine Dragons
109,Set Fire to the Rain Adele
110,"Money Trees Kendrick Lamar, Jay Rock"
111,Tak Segampang Itu Anggi Marito
112,"LAGUNAS Jasiel Nuï¿½ï¿½ez, Peso P"
113,Mine (Taylor's Version) Taylor Swift
114,Everybody Wants To Rule The World Tears For Fears
115,No Role Modelz J. Cole
116,Tattoo Loreen
117,"Rara Vez Taiu, Milo j"
118,"VAGABUNDO Sebastian Yatra, Manuel Turizo, Beï¿½ï"
119,august Taylor Swift
120,"LUNA Junior H, Peso Pluma"
121,"Miracle (with Ellie Goulding) Calvin Harris, Ellie Goulding"
122,Nonsense Sabrina Carpenter
123,"Que Vuelvas Carin Leon, Grupo Frontera"
124,Por las Noches Peso Pluma
125,Feliz Cumpleaï¿½ï¿½os Fe Feid
126,"Can't Hold Us (feat. Ray Dalton) Ray Dalton, Ryan Lewis, Macklemore"
127,Watermelon Sugar Harry Styles
128,"lovely - Bonus Track Billie Eilish, Khalid"
129,"Rauw Alejandro: Bzrp Music Sessions, Vol. 56 Rauw Alejandro, Bizarrap"
130,Queencard (G)I-DLE
131,OMG NewJeans
132,Radio Lana Del Rey
133,"Shakira: Bzrp Music Sessions, Vol. 53 Shakira, Bizarrap"
134,505 Arctic Monkeys
135,"Calling (Spider-Man: Across the Spider-Verse) (Metro Boomin & Swae Lee, NAV, feat. A Boogie Wit da Hoodie) Swae Lee, A Boogie Wit da Hoodie, Metro Boomin, NAV"
136,"Trance (with Travis Scott & Young Thug) Travis Scott, Young Thug, Metro Boomin"
137,"Tere Vaaste (From ""Zara Hatke Zara Bachke"") Sachin-Jigar, Shadab Faridi, Altamash Faridi, Amitabh Bhattacharya, Varun Jain"
138,Perfect Ed Sheeran
139,Romantic Homicide d4vd
140,Believer Imagine Dragons
141,"Novo Balanï¿½ Veigh, Bvga Beatz, Supernova Ent, Prod Malax"
142,"Gol Bolinha, Gol Quadrado 2 Mc Pedrinho, DJ 900"
143,Without Me Eminem
144,"QUEMA Sog, Ryan Castro, Peso Pluma"
145,"Stargirl Interlude The Weeknd, Lana Del Rey"
146,"Ojitos Lindos Bomba Estï¿½ï¿½reo, Bad B"
147,Somewhere Only We Know Keane
148,Those Eyes New West
149,El Gordo Trae El Mando Chino Pacas
150,Mi Bello Angel Natanael Cano
151,Bye Peso Pluma
152,"Danza Kuduro Don Omar, Lucenzo"
153,"Nosso Quadro Ana Castela, AgroPlay"
154,Locked Out Of Heaven Bruno Mars
155,"Un Finde | CROSSOVER #2 Big One, FMK, Ke personajes"
156,"Jimmy Cooks (feat. 21 Savage) Drake, 21 Savage"
157,Counting Stars OneRepublic
158,Ghost Justin Bieber
159,Under The Influence Chris Brown
160,"PRC Natanael Cano, Peso Pluma"
161,Gasolina Daddy Yankee
162,"One Dance Drake, WizKid, Kyla"
163,Enchanted Taylor Swift
164,Save Your Tears The Weeknd
165,Sure Thing Miguel
166,Every Breath You Take - Remastered 2003 The Police
167,The Night We Met Lord Huron
168,"We Found Love Rihanna, Calvin Harris"
169,When I Was Your Man Bruno Mars
170,Let Me Down Slowly Alec Benjamin
171,"Am I Dreaming (Metro Boomin & A$AP Rocky, Roisee) A$AP Rocky, Metro Boomin, Roisee"
172,Do I Wanna Know? Arctic Monkeys
173,Demons Imagine Dragons
174,ýýýýýýýýýýýý YOASOBI
175,Reminder The Weeknd
176,Shake It Off Taylor Swift
177,Why'd You Only Call Me When You're High? Arctic Monkeys
178,SNAP Rosa Linn
179,Shape of You Ed Sheeran
180,Night Changes One Direction
181,"Fin de Semana Oscar Maydon, Junior H"
182,Creep Radiohead
183,Car's Outside James Arthur
184,Apocalypse Cigarettes After Sex
185,Cheques Shubh
186,Pink + White Frank Ocean
187,Circles Post Malone
188,Just The Way You Are Bruno Mars
189,Take Me To Church Hozier
190,"Bebe Dame Fuerza Regida, Grupo Frontera"
191,You Belong With Me (Taylorï¿½ï¿½ï¿½s Ve Taylor Swift
192,Titi Me Preguntï¿ Bad Bunny
193,Better Than Revenge (Taylor's Version) Taylor Swift
194,Shut up My Moms Calling Hotel Ugly
195,Have You Ever Seen The Rain? Creedence Clearwater Revival
196,Es un Secreto Plan B
197,"POLARIS - Remix Feid, Mora, Saiko, Quevedo"
198,Ditto NewJeans
199,Take On Me a-ha
200,"Annihilate (Spider-Man: Across the Spider-Verse) (Metro Boomin & Swae Lee, Lil Wayne, Offset) Swae Lee, Lil Wayne, Offset, Metro Boomin"
201,"Angel Pt 1 (feat. Jimin of BTS, JVKE & Muni Long) Kodak Black, NLE Choppa, Muni Long, JVKE, Jimin"
202,Acrï¿½ï¿½s Shakira
203,"AMG Natanael Cano, Gabito Ballesteros, Peso Pluma"
204,"Phir Aur Kya Chahiye (From ""Zara Hatke Zara Bachke"") Arijit Singh, Sachin-Jigar, Amitabha Bhattacharya"
205,S-Class Stray Kids
206,Hits Different Taylor Swift
207,"Chanel Becky G, Peso Pluma"
208,"Self Love (Spider-Man: Across the Spider-Verse) (Metro Boomin & Coi Leray) Metro Boomin, Coi Leray"
209,"Area Codes Kaliii, Kaliii"
210,"Abcdario Junior H, Eden Muï¿½ï"
211,"Obsessed Abhijay Sharma, Riar Saab"
212,"Piï¿½ï¿½man Deï¿ Semicenk, Doï¿½ï¿½u "
213,FLOWER JISOO
214,"All The Way Live (Spider-Man: Across the Spider-Verse) (Metro Boomin & Future, Lil Uzi Vert) Future, Lil Uzi Vert, Metro Boomin"
215,Eyes Closed Ed Sheeran
216,"Escapism. RAYE, 070 Shake"
217,"La Jumpa Arcangel, Bad Bunny"
218,"Karma (feat. Ice Spice) Taylor Swift, Ice Spice"
219,"Superhero (Heroes & Villains) [with Future & Chris Brown] Future, Chris Brown, Metro Boomin"
220,"Las Morras BLESSD, Peso Pluma"
221,CHORRITO PA LAS ANIMAS Feid
222,"Ch y la Pizza Fuerza Regida, Natanael Cano"
223,"Snow On The Beach (feat. More Lana Del Rey) Lana Del Rey, Taylor Swift"
224,Players Coi Leray
225,Bite Me ENHYPEN
226,"Stand By Me (feat. Morgan Wallen) Lil Durk, Morgan Wallen"
227,Normal Feid
228,"Hummingbird (Metro Boomin & James Blake) James Blake, Metro Boomin"
229,"Seu Brilho Sumiu - Ao Vivo Israel & Rodolffo, Mari Fernandez"
230,Bad Habit Steve Lacy
231,CUFF IT Beyoncï¿
232,"Lilith (feat. SUGA of BTS) (Diablo IV Anthem) Halsey, Suga"
233,"69 Nicky Jam, Feid"
234,"Niï¿½ï¿½a Bo Sean Paul, Feid"
235,Search & Rescue Drake
236,"AMERICA HAS A PROBLEM (feat. Kendrick Lamar) Kendrick Lamar, Beyoncï¿"
237,Lavender Haze Taylor Swift
238,"Link Up (Metro Boomin & Don Toliver, Wizkid feat. BEAM & Toian) - Spider-Verse Remix (Spider-Man: Across the Spider-Verse ) WizKid, Toian, Metro Boomin, Don Toliver, Beam"
239,Efecto Bad Bunny
240,Erro Gostoso - Ao Vivo Simone Mendes
241,Cupido Tini
242,Just Wanna Rock Lil Uzi Vert
243,Unstoppable Sia
244,Until I Found You Stephen Sanchez
245,"Rich Flex Drake, 21 Savage"
246,Easy On Me Adele
247,"Cartï¿½ï¿½o B MC Caverinha, KayBlack"
248,"Danger (Spider) (Offset & JID) Offset, JID"
249,Oi Balde - Ao Vivo Zï¿½ï¿½ Neto & Crist
250,The Real Slim Shady Eminem
251,"MERCHO Migrantes, LiL CaKe, Nico Valdi"
252,The Color Violet Tory Lanez
253,Glimpse of Us Joji
254,"Mejor Que Yo Mambo Kingz, DJ Luian, Anuel Aa"
255,Curtains Ed Sheeran
256,"UNFORGIVEN (feat. Nile Rodgers) Nile Rodgers, LE SSERAFIM"
257,Haegeum Agust D
258,"Conexï¿½ï¿½es de Mï¿½ï¿½fia (feat. Rich  Rich The Kid, Matuï¿"
259,MIENTRAS ME CURO DEL CORA Karol G
260,Never Felt So Alone Labrinth
261,"X SI VOLVEMOS Karol G, Romeo Santos"
262,ceilings Lizzy McAlpine
263,Cupid Fifty Fifty
264,I AM IVE
265,Cupid ï¿½ï¿½ï¿½ Twin Ver. (FIFTY FIFTY) ï¿½ï¿½ï¿½ Spe sped up 8282
266,"Shorty Party Cartel De Santa, La Kelly"
267,Super SEVENTEEN
268,Slut Me Out NLE Choppa
269,"Double Fantasy (with Future) The Weeknd, Future"
270,All Of The Girls You Loved Before Taylor Swift
271,PROVENZA Karol G
272,"Princess Diana (with Nicki Minaj) Nicki Minaj, Ice Spice"
273,"Di Que Si Grupo Marca Registrada, Grupo Frontera"
274,Shivers Ed Sheeran
275,"Igualito a Mi Apï¿ Fuerza Regida, Peso Pluma"
276,"Shoong! (feat. LISA of BLACKPINK) TAEYANG, Lisa"
277,Komang Raim Laode
278,DESPECHï¿ ROSALï¿½
279,Made You Look Meghan Trainor
280,"Watch This - ARIZONATEARS Pluggnb Remix sped up nightcore, ARIZONATEARS, Lil Uzi Vert"
281,No Se Va Grupo Frontera
282,Punto G Quevedo
283,Lovers Rock TV Girl
284,METAMORPHOSIS INTERWORLD
285,"Mami Chula Quevedo, Jhayco"
286,"En Paris El Chachito, Junior H"
287,Set Me Free Pt.2 Jimin
288,"I Was Never There The Weeknd, Gesaffelstein"
289,"Don't ever say love me (feat. RM of BTS) RM, Colde"
290,Shut Down BLACKPINK
291,"Gato de Noche Nengo Flow, Bad Bunny"
292,Call Out My Name The Weeknd
293,Like Crazy (English Version) Jimin
294,"Rosa Pastel Jasiel Nuï¿½ï¿½ez, Peso P"
295,"Sunroof Nicky Youre, Dazy"
296,Lose Yourself - Soundtrack Version Eminem
297,"Superman Eminem, Dina Rae"
298,"Mas Rica Que Ayer Mambo Kingz, DJ Luian, Anuel Aa"
299,"People Pt.2 (feat. IU) IU, Agust D"
300,REMIX EXCLUSIVO Feid
301,"Arcï¿½ï¿½ngel: Bzrp Music Sessions, Vol Arcangel, Bizarrap"
302,"DOGTOOTH Tyler, The Creator"
303,"10:35 Tiï¿½ï¿½sto, Tate M"
304,"SORRY NOT SORRY Tyler, The Creator"
305,HAPPY NF
306,La Bebe Yng Lvcas
307,"I Know - PR1SVX Edit Kanii, PR1ISVX"
308,Late Night Talking Harry Styles
309,Leï¿½ Marï¿½ï¿½lia Mendo
310,"Save Your Tears (with Ariana Grande) (Remix) Ariana Grande, The Weeknd"
311,Something in the Orange Zach Bryan
312,VOID Melanie Martinez
313,"Dijeron Que No La Iba Lograr Fuerza Regida, Chino Pacas"
314,Midnight Rain Taylor Swift
315,If We Ever Broke Up Mae Stephens
316,You Proof Morgan Wallen
317,"LA INOCENTE Feid, Mora"
318,Malas Decisiones Kenia OS
319,Murder In My Mind Kordhell
320,"Gangsta's Paradise Coolio, L.V."
321,"CAIRO Karol G, Ovy On The Drums"
322,I Love You So The Walters
323,Dark Red Steve Lacy
324,Say You Won't Let Go James Arthur
325,The Hills The Weeknd
326,Heart To Heart Mac DeMarco
327,Peaches (from The Super Mario Bros. Movie) Jack Black
328,"Marisola - Remix Duki, NICKI NICOLE, Cris Mj, Standly, Stars Music Chile"
329,"LOKERA Brray, Rauw Alejandro, Lyanno"
330,Low SZA
331,Numb Linkin Park
332,"Tormenta (feat. Bad Bunny) Gorillaz, Bad Bunny"
333,"on the street (with J. Cole) j-hope, J. Cole"
334,One Thing At A Time Morgan Wallen
335,"Miss You Robin Schulz, Oliver Tree"
336,Ainï¿½ï¿½ï¿½t Tha Morgan Wallen
337,Thinkinï¿½ï¿½ï¿½ B Morgan Wallen
338,"Private Landing (feat. Justin Bieber & Future) Don Toliver, Future, Justin Bieber"
339,Everything I Love Morgan Wallen
340,Heaven Niall Horan
341,LET GO Central Cee
342,Sial Mahalini
343,I Wrote The Book Morgan Wallen
344,"Apna Bana Le (From ""Bhediya"") Arijit Singh, Sachin-Jigar"
345,SPIT IN MY FACE! ThxSoMch
346,"PLAYA DEL INGLï¿½ Myke Towers, Quevedo"
347,"Man Made A Bar (feat. Eric Church) Morgan Wallen, Eric Church"
348,Red Ruby Da Sleeze Nicki Minaj
349,Kahani Suno 2.0 Kaifi Khalil
350,Nobody Gets Me SZA
351,"PERO Tï¿ Karol G, Quevedo"
352,Hype Boy NewJeans
353,Bloody Mary Lady Gaga
354,"Monotonï¿½ Ozuna, Shakira"
355,ýýý98 Braves Morgan Wallen
356,WANDA Quevedo
357,Thought You Should Know Morgan Wallen
358,In The End Linkin Park
359,Zona De Perigo Leo Santana
360,Lovezinho Treyce
361,"I Like You (A Happier Song) (with Doja Cat) Post Malone, Doja Cat"
362,Neverita Bad Bunny
363,Vista Al Mar Quevedo
364,"Sem Alianï¿½ï¿½a no  MC Xenon, Os Gemeos da Putaria"
365,"Enemy (with JID) - from the series Arcane League of Legends Imagine Dragons, League of Legends, JID, Arcane"
366,Revenge XXXTENTACION
367,"Bombonzinho - Ao Vivo Israel & Rodolffo, Ana Castela"
368,"LA CANCIï¿½ J Balvin, Bad Bunny"
369,"Quï¿½ï¿½ Ago Yuridia, Angela Aguilar"
370,Love Again The Kid Laroi
371,After Hours The Weeknd
372,About Damn Time Lizzo
373,Born With A Beer In My Hand Morgan Wallen
374,ýýýýýýýýýýýýýýýýýýýýý Fujii Kaze
375,"Besos Moja2 Wisin & Yandel, ROSALï¿½"
376,Maan Meri Jaan King
377,Moscow Mule Bad Bunny
378,"My Universe Coldplay, BTS"
379,Devil Donï¿½ï¿½ï¿½ Morgan Wallen
380,LLYLM ROSALï¿½
381,"I'm Not Here To Make Friends Sam Smith, Calvin Harris, Jessie Reyez"
382,TRUSTFALL P!nk
383,ANTIFRAGILE LE SSERAFIM
384,Boy's a liar PinkPantheress
385,"VIBE (feat. Jimin of BTS) TAEYANG, Jimin"
386,Shirt SZA
387,Lift Me Up - From Black Panther: Wakanda Forever - Music From and Inspired By Rihanna
388,STAR WALKIN' (League of Legends Worlds Anthem) Lil Nas X
389,"Sex, Drugs, Etc. Beach Weather"
390,"Boy With Luv (feat. Halsey) Halsey, BTS"
391,"Hey, Mickey! Baby Tate"
392,Calm Down Rï¿½ï
393,"Jhoome Jo Pathaan Arijit Singh, Vishal Dadlani, Sukriti Kakar, Vishal-Shekhar, Shekhar Ravjiani, Kumaar"
394,"Escapism. - Sped Up RAYE, 070 Shake"
395,Space Song Beach House
396,"Dreamers [Music from the FIFA World Cup Qatar 2022 Official Soundtrack] BTS, Jung Kook, FIFA Sound"
397,"Te Felicito Shakira, Rauw Alejandro"
398,"Muï¿½ï¿½ Steve Aoki, Tini, La Joaqui"
399,TV Billie Eilish
400,I'm Not The Only One Sam Smith
401,Heather Conan Gray
402,"Besharam Rang (From ""Pathaan"") Vishal-Shekhar, Shilpa Rao, Caralisa Monteiro, Kumaar, Vishal Dadlani, Shekhar Ravjiani"
403,"One Kiss (with Dua Lipa) Calvin Harris, Dua Lipa"
404,Sugar Rush Ride TOMORROW X TOGETHER
405,Pink Venom BLACKPINK
406,"WAIT FOR U (feat. Drake & Tems) Drake, Future, Tems"
407,Don't Start Now Dua Lipa
408,After Dark Mr.Kitty
409,"Eu Gosto Assim - Ao Vivo Gustavo Mioto, Mari Fernandez"
410,"INDUSTRY BABY (feat. Jack Harlow) Jack Harlow, Lil Nas X"
411,MIDDLE OF THE NIGHT Elley Duhï¿
412,Atlantis Seafret
413,"PUNTO 40 Baby Rasta, Rauw Alejandro"
414,"Evoque Prata DJ Escobar, MC MENOR SG, MC MENOR HR"
415,How Do I Say Goodbye Dean Lewis
416,Blind SZA
417,Die For You Joji
418,Doja Central Cee
419,Gatita Bellakath
420,"Rumble Skrillex, Flowdan, Fred again.."
421,"Niagara Falls (Foot or 2) [with Travis Scott & 21 Savage] Travis Scott, 21 Savage, Metro Boomin"
422,Yonaguni Bad Bunny
423,Super Freaky Girl Nicki Minaj
424,Running Up That Hill (A Deal With God) Kate Bush
425,Dream On Aerosmith
426,Limbo Freddie Dredd
427,"Where Are You Now Lost Frequencies, Calum Scott"
428,"WORTH NOTHING Twisted, Oliver Tree"
429,Bad Habits Ed Sheeran
430,KICK BACK Kenshi Yonezu
431,Evergreen (You Didnï¿½ï¿½ï¿½t Deserve Me A Omar Apollo
432,Good Days SZA
433,"Levitating (feat. DaBaby) Dua Lipa, DaBaby"
434,Woman Doja Cat
435,Shut up My Moms Calling - (Sped Up) Hotel Ugly
436,"Ferrari James Hype, Miggy Dela Rosa"
437,"You're On Your Own, Kid Taylor Swift"
438,"Kesariya (From ""Brahmastra"") Pritam, Arijit Singh, Amitabh Bhattacharya"
439,"Agudo Mï¿½ï¿½gi Styrx, utku INC, Thezth"
440,"Payphone Maroon 5, Wiz Khalifa"
441,All I Want for Christmas Is You Mariah Carey
442,Last Christmas Wham!
443,Rockin' Around The Christmas Tree Brenda Lee
444,Jingle Bell Rock Bobby Helms
445,It's Beginning To Look A Lot Like Christmas Michael Bublï¿
446,Santa Tell Me Ariana Grande
447,It's the Most Wonderful Time of the Year Andy Williams
448,Let It Snow! Let It Snow! Let It Snow! Dean Martin
449,Snowman Sia
450,Underneath the Tree Kelly Clarkson
451,Feliz Navidad Josï¿½ï¿½ Felic
452,Holly Jolly Christmas Michael Bublï¿
453,Mistletoe Justin Bieber
454,Sleigh Ride The Ronettes
455,Seek & Destroy SZA
456,Love Language SZA
457,"Happy Xmas (War Is Over) John Lennon, The Harlem Community Choir, The Plastic Ono Band, Yoko Ono"
458,"Used (feat. Don Toliver) SZA, Don Toliver"
459,A Holly Jolly Christmas - Single Version Burl Ives
460,The Christmas Song (Merry Christmas To You) - Remastered 1999 Nat King Cole
461,Wonderful Christmastime - Edited Version / Remastered 2011 Paul McCartney
462,Do They Know It's Christmas? - 1984 Version Band Aid
463,"Ghost in the Machine (feat. Phoebe Bridgers) SZA, Phoebe Bridgers"
464,Special SZA
465,Merry Christmas Everyone Shakin' Stevens
466,"Let It Snow! Let It Snow! Let It Snow! Frank Sinatra, B. Swanson Quartet"
467,SOS SZA
468,"Open Arms (feat. Travis Scott) SZA, Travis Scott"
469,"White Christmas Bing Crosby, John Scott Trotter & His Orchestra, Ken Darby Singers"
470,Driving Home for Christmas - 2019 Remaster Chris Rea
471,Christmas (Baby Please Come Home) Darlene Love
472,Gone Girl SZA
473,F2F SZA
474,Notice Me SZA
475,"Merry Christmas Ed Sheeran, Elton John"
476,"It's Beginning to Look a Lot Like Christmas (with Mitchell Ayres & His Orchestra) Perry Como, The Fontane Sisters, Mitchell Ayres & His Orchestra"
477,My Only Wish (This Year) Britney Spears
478,"Antidepresan Mabel Matiz, Mert Demir"
479,Wild Flower (with youjeen) RM
480,I Hate U SZA
481,"Raindrops (Insane) [with Travis Scott] Travis Scott, Metro Boomin"
482,SPIT IN MY FACE! ThxSoMch
483,Deck The Hall - Remastered 1999 Nat King Cole
484,Smoking on my Ex Pack SZA
485,Conceited SZA
486,"Snow On The Beach (feat. Lana Del Rey) Taylor Swift, Lana Del Rey"
487,Maroon Taylor Swift
488,"Tubarï¿½ï¿½o Te Dj LK da Escï¿½ï¿½cia, Tchakabum, mc jhenny, M"
489,Bejeweled Taylor Swift
490,"Tarot Bad Bunny, Jhay Cortez"
491,"You Make It Feel Like Christmas (feat. Blake Shelton) Gwen Stefani, Blake Shelton"
492,"Desesperados Chencho Corleone, Rauw Alejandro"
493,Too Late SZA
494,"Party Bad Bunny, Rauw Alejandro"
495,Run Rudolph Run - Single Version Chuck Berry
496,Jingle Bells - Remastered 1999 Frank Sinatra
497,Far SZA
498,"On Time (with John Legend) John Legend, Metro Boomin"
499,"GATï¿½ï¿½ Maldy, Karol G"
500,ýýýabcdefu Gayle
501,Sacrifice The Weeknd
502,Is There Someone Else? The Weeknd
503,"Fingers Crossed Lauren Spencer Smith, Lauren Spencer Smith, Lauren Spencer Smith"
504,Out of Time The Weeknd
505,"Do It To It Cherish, ACRAZE"
506,"We Don't Talk About Bruno Adassa, Mauro Castillo, Stephanie Beatriz, Encanto - Cast, Rhenzy Feliz, Diane Guerrero, Carolina Gaitan"
507,Pepas Farruko
508,How Do I Make You Love Me? The Weeknd
509,Gasoline The Weeknd
510,Infinity Jaymes Young
511,Less Than Zero The Weeknd
512,Take My Breath The Weeknd
513,good 4 u Olivia Rodrigo
514,"Here We Goï¿½ï¿½ï¿½ Again (feat. Tyler, the Cr The Weeknd, Tyler, The Creator"
515,Best Friends The Weeknd
516,"Kiss Me More (feat. SZA) SZA, Doja Cat"
517,"I Heard You're Married (feat. Lil Wayne) The Weeknd, Lil Wayne"
518,Need To Know Doja Cat
519,MONTERO (Call Me By Your Name) Lil Nas X
520,love nwantiti (ah ah ah) Ckay
521,Dawn FM The Weeknd
522,Surface Pressure Jessica Darrow
523,Starry Eyes The Weeknd
524,THATS WHAT I WANT Lil Nas X
525,"One Right Now (with The Weeknd) The Weeknd, Post Malone"
526,Beggin Mï¿½ï¿½ne
527,"Mon Amour - Remix Aitana, zzoilo"
528,"Lo Siento BB:/ (with Bad Bunny & Julieta Venegas) Julieta Venegas, Bad Bunny, Tainy"
529,MONEY Lisa
530,"The Motto Tiï¿½ï¿½sto, Ava"
531,Happier Than Ever Billie Eilish
532,"Moth To A Flame (with The Weeknd) The Weeknd, Swedish House Mafia"
533,"traitor Juan Cruz Toledo, Huilen Toledo"
534,Toxic BoyWithUke
535,drivers license Olivia Rodrigo
536,"Malvadï¿½ï¿ Xamï¿½ï¿½, Gustah, Neo B"
537,All Too Well (10 Minute Version) (Taylor's Version) (From The Vault) Taylor Swift
538,Donï¿½ï¿½ï¿½t Break My The Weeknd
539,Oh My God Adele
540,"Entre Nosotros (Remix) [con Nicki Nicole] Lit Killah, Maria Becerra, Tiago pzk, NICKI NICOLE"
541,A Tale By Quincy The Weeknd
542,I AM WOMAN Emmy Meli
543,"Medallo Justin Quiles, Lenny Tavï¿½ï¿½rez, BL"
544,It'll Be Okay Shawn Mendes
545,Softcore The Neighbourhood
546,Super Gremlin Kodak Black
547,"Volvï¿ Aventura, Bad Bunny"
548,Todo De Ti Rauw Alejandro
549,"Love Nwantiti - Remix Ckay, AX'EL, Dj Yo!"
550,"Smokin Out The Window Bruno Mars, Anderson .Paak, Silk Sonic"
551,"Meet Me At Our Spot THE ANXIETY, Willow, Tyler Cole"
552,Every Angel is Terrifying The Weeknd
553,Tacones Rojos Sebastian Yatra
554,"Peaches (feat. Daniel Caesar & Giveon) Justin Bieber, Daniel Caesar, Giveon"
555,"Dakiti Bad Bunny, Jhay Cortez"
556,"Tiago PZK: Bzrp Music Sessions, Vol. 48 Bizarrap, Tiago pzk"
557,Lï¿½ï¿½ï¿ Stromae
558,"Nostï¿½ï¿½l Chris Brown, Rvssian, Rauw Alejandro"
559,"Better Days (NEIKED x Mae Muller x Polo G) NEIKED, Mae Muller, Polo G"
560,Life Goes On Oliver Tree
561,"Sad Girlz Luv Money Remix (feat. Kali Uchis) Kali Uchis, Amaarae, Moliy"
562,Butter BTS
563,"pushin P (feat. Young Thug) Young Thug, Future, Gunna"
564,"You Right Doja Cat, The Weeknd"
565,deja vu Olivia Rodrigo
566,Dynamite BTS
567,TO THE MOON Jnr Choi
568,"Lost in the Fire The Weeknd, Gesaffelstein"
569,"Salimo de Noche Trueno, Tiago pzk"
570,"Volando - Remix Sech, Bad Bunny, Mora"
571,"Leave The Door Open Bruno Mars, Anderson .Paak, Silk Sonic"
572,"Knife Talk (with 21 Savage ft. Project Pat) Drake, Project Pat, 21 Savage"
573,"Don't Be Shy Tiï¿½ï¿½sto, Kar"
574,Love Grows (Where My Rosemary Goes) Edison Lighthouse
575,"LA FAMA (with The Weeknd) The Weeknd, ROSALï¿½"
576,"The Family Madrigal Olga Merediz, Stephanie Beatriz, Encanto - Cast"
577,Phantom Regret by Jim The Weeknd
578,Dos Oruguitas Sebastian Yatra
579,Freaks Surf Curse
580,Acapulco Jason Derulo
581,Daddy Issues The Neighbourhood
582,"thought i was playing 21 Savage, Gunna"
583,ELEVEN IVE
584,"Mood (feat. Iann Dior) 24kgoldn, Iann Dior"
585,"What Else Can I Do? Stephanie Beatriz, Diane Guerrero"
586,DANCE CRIP Trueno
587,Miserable Man David Kushner
588,happier Olivia Rodrigo
589,Praise God Kanye West
590,Get Into It (Yuh) Doja Cat
591,Before You Go Lewis Capaldi
592,Sky Playboi Carti
593,Rolling in the Deep Adele
594,Sobrio Maluma
595,"Peru Ed Sheeran, Fireboy DML"
596,favorite crime Olivia Rodrigo
597,"Thunder Prezioso, Gabry Ponte, LUM!X"
598,The Business Tiï¿½ï¿
599,positions Ariana Grande
600,I WANNA BE YOUR SLAVE Mï¿½ï¿½ne
601,"Vai Lï¿½ï¿½ Em Casa  Marï¿½ï¿½lia Mendonï¿½ï¿½a, George Henrique &"
602,The Feels TWICE
603,HEARTBREAK ANNIVERSARY Giveon
604,"No Lie Sean Paul, Dua Lipa"
